A股代码,B股代码,证券简称,扩位证券简称,公司英文全称,上市日期
600000,-,浦发银行,浦发银行,"Shanghai Pudong Development Bank Co.,Ltd.",19991110
600004,-,白云机场,白云机场,Guangzhou Baiyun International Airport Company Limited,20030428
600006,-,东风汽车,东风汽车,"DONGFENG AUTOMOBILE CO.,LTD.",19990727
600007,-,中国国贸,中国国贸,"China World Trade Center Co.,Ltd.",19990312
600008,-,首创环保,首创环保,"Beijing Capital Eco-Environment Protection GroupCo.,Ltd.",20000427
600009,-,上海机场,上海机场,"Shanghai International Airport Co.,Ltd.",19980218
600010,-,包钢股份,包钢股份,"Inner Mongolia Baotou Steel Union Co.,Ltd",20010309
600011,-,华能国际,华能国际,"Huaneng Power International,Inc.",20011206
600012,-,皖通高速,皖通高速,Anhui Expressway Company Limited,20030107
600015,-,华夏银行,华夏银行,"Hua Xia Bank Co.,Limited",20030912
600016,-,民生银行,民生银行,"China Minsheng Banking Corp., Ltd.",20001219
600017,-,日照港,日照港,"Rizhao Port Co.,Ltd.",20061017
600018,-,上港集团,上港集团,"Shanghai International Port (Group) Co., Ltd.",20000719
600019,-,宝钢股份,宝钢股份,"Baoshan Iron & Steel Co.,Ltd.",20001212
600020,-,中原高速,中原高速,"Henan Zhongyuan Expressway Co.,Ltd.",20030808
600021,-,上海电力,上海电力,"Shanghai Electric Power Co.,Ltd",20031029
600022,-,山东钢铁,山东钢铁,Shandong Iron and Steel Company Ltd,20040629
600023,-,浙能电力,浙能电力,"Zhejiang Zheneng Electric Power CO.,LTD",20131219
600025,-,华能水电,华能水电,Huaneng Lancang River Hydropower Inc.,20171215
600026,-,中远海能,中远海能,"Cosco Shipping Energy Transportation Co., Ltd.",20020523
600027,-,华电国际,华电国际,Huadian Power International Corporation Limited,20050203
600028,-,中国石化,中国石化,China Petroleum & Chemical Corporation,20010808
600029,-,南方航空,南方航空,China Southern Airlines Company Limited,20030725
600030,-,中信证券,中信证券,CITIC Securities Company Limited,20030106
600031,-,三一重工,三一重工,"SANY HEAVY INDUSTRY CO.,LTD",20030703
600032,-,浙江新能,浙江新能,"Zhejiang Provincial New Energy Investment Group Co., Ltd.",20210525
600033,-,福建高速,福建高速,"Fujian Expressway Development Co.,Ltd",20010209
600035,-,楚天高速,楚天高速,"Hubei Chutian Smart Communication Co.,Ltd.",20040310
600036,-,招商银行,招商银行,"China Merchants Bank Co., Ltd.",20020409
600037,-,歌华有线,歌华有线,"Beijing Gehua CATV Network Co., Ltd.",20010208
600038,-,中直股份,中直股份,Avicopter Plc.,20001218
600039,-,四川路桥,四川路桥,"SICHUAN ROAD&BRIDGE GROUP CO.,LTD.",20030325
600048,-,保利发展,保利发展,"Poly Developments and Holdings Group Co., Ltd.",20060731
600050,-,中国联通,中国联通,China United Network Communications Limited,20021009
600051,-,宁波联合,宁波联合,"Ningbo United Group Co.,Ltd.",19970410
600052,-,东望时代,东望时代,"ZHEJIANG DONGWANG TIMES TECHNOLOGY CO., LTD.",19970415
600053,-,九鼎投资,九鼎投资,"Kunwu Jiuding Investment Holdings Co., Ltd",19970418
600054,900942,黄山旅游,黄山旅游,"Huangshan Tourism Development Co.,Ltd.",19970506
600055,-,万东医疗,万东医疗,"Beijing Wandong Medical Technology Co., Ltd.",19970519
600056,-,中国医药,中国医药,"China Meheco Group Co., Ltd.",19970515
600057,-,厦门象屿,厦门象屿,"Xiamen Xiangyu Co., Ltd.",19970604
600058,-,五矿发展,五矿发展,"Minmetals Development Co.,Ltd",19970528
600059,-,古越龙山,古越龙山,"Zhejiang Guyuelongshan Shaoxing Wine Co.,Ltd",19970516
600060,-,海信视像,海信视像,"Hisense Visual Technology Co.,Ltd.",19970422
600061,-,国投资本,国投资本,"SDIC Capital Co., Ltd",19970519
600062,-,华润双鹤,华润双鹤,"China Resources Double-Crane Pharmaceutical Co.,Ltd.",19970522
600063,-,皖维高新,皖维高新,"Anhui Wanwei Updated High-Tech Material Industry Co.,Ltd",19970528
600064,-,南京高科,南京高科,Nanjing Gaoke Company Limited,19970506
600066,-,宇通客车,宇通客车,"Yutong Bus Co.,Ltd.",19970508
600067,-,冠城大通,冠城大通,"Citychamp Dartong Co.,Ltd.",19970508
600070,-,浙江富润,浙江富润,"Zhejiang Furun Digital Technology Co.,Ltd",19970604
600071,-,凤凰光学,凤凰光学,Phenix Optics Company Limited,19970528
600072,-,中船科技,中船科技,"CSSC Science & Technology Co., Ltd",19970603
600073,-,上海梅林,上海梅林,"Shanghai Maling Aquarius Co.,Ltd",19970704
600075,-,新疆天业,新疆天业,"Xinjiang Tianye Co.,Ltd.",19970617
600076,-,康欣新材,康欣新材,"Kangxin New Materials Co.,Ltd",19970526
600077,-,宋都股份,宋都股份,"Sundy Land Investment Co., Ltd",19970520
600078,-,ST澄星,ST澄星,"Jiangsu Chengxing Phosph-Chemical Co.,Ltd",19970627
600079,-,人福医药,人福医药,"Humanwell Healthcare (Group) Co.,Ltd.",19970606
600080,-,金花股份,金花股份,Ginwa Enterprise(Group)Inc.,19970612
600081,-,东风科技,东风科技,"Dongfeng Electronic Technology Co.,Ltd.",19970703
600082,-,海泰发展,海泰发展,"Tianjin Hi-Tech Development Co.,Ltd.",19970620
600083,-,博信股份,博信股份,"JIANGSU BOXIN INVESTING & HOLDINGS CO,.LTD",19970606
600084,-,中葡股份,中葡股份,"CITIC Guoan Wine Co.,Ltd",19970711
600085,-,同仁堂,同仁堂,"Beijing Tongrentang Co.,Ltd",19970625
600088,-,中视传媒,中视传媒,"China Television Media,Ltd.",19970616
600089,-,特变电工,特变电工,"TBEA Co.,Ltd.",19970618
600094,900940,大名城,大名城,Greattown Holdings Ltd.,19970703
600095,-,湘财股份,湘财股份,"Xiangcai Co.,Ltd",19970708
600096,-,云天化,云天化,"Yunnan Yuntianhua Co.,Ltd",19970709
600097,-,开创国际,开创国际,"Shanghai Kaichuang Marine International Co.,Ltd.",19970619
600098,-,广州发展,广州发展,Guangzhou Development Group Incorporated,19970718
600099,-,林海股份,林海股份,"Linhai Co.,Ltd.",19970704
600100,-,同方股份,同方股份,"Tsinghua Tongfang Co.,Ltd.",19970627
600101,-,明星电力,明星电力,"Sichuan Mingxing Electric Power Co.,Ltd.",19970627
600103,-,青山纸业,青山纸业,"Fujian Qingshan Paper Industry Co.,Ltd.",19970703
600104,-,上汽集团,上汽集团,SAIC Motor Corporation Limited,19971125
600105,-,永鼎股份,永鼎股份,Jiangsu Etern Company Limited,19970929
600106,-,重庆路桥,重庆路桥,"Chongqing Road&Bridge Co.,Ltd",19970618
600107,-,美尔雅,美尔雅,"Hubei Mailyard Share Co.,Ltd",19971106
600108,-,亚盛集团,亚盛集团,"Gansu Yasheng Industrial (Group) Co.,Ltd",19970818
600109,-,国金证券,国金证券,"Sinolink Securities Co., Ltd.",19970807
600110,-,诺德股份,诺德股份,"NUODE NEW MATERIALS CO.,LTD.",19971007
600111,-,北方稀土,北方稀土,"China Northern Rare Earth (Group) High-Tech Co.,Ltd",19970924
600112,-,ST天成,ST天成,"Guizhou Changzheng Tiancheng Holding Co.,Ltd.",19971127
600113,-,浙江东日,浙江东日,Zhejiang Dong Ri Limited Company,19971021
600114,-,东睦股份,东睦股份,"NBTM New Materials Group Co., Ltd.",20040511
600115,-,中国东航,中国东航,China Eastern Airlines Corporation Limited,19971105
600116,-,三峡水利,三峡水利,"Chongqing Three Gorges Water Conservancy and Electric Power Co.,Ltd.",19970804
600117,-,西宁特钢,西宁特钢,"Xining Special Steel Co.,Ltd",19971015
600118,-,中国卫星,中国卫星,"China Spacesat Co.,Ltd.",19970908
600119,-,长江投资,长江投资,"Y.U.D.Yangtze River Investment Industry Co.,Ltd.",19980115
600120,-,浙江东方,浙江东方,"Zhejiang Orient Financial Holdings Group Co.,Ltd.",19971201
600121,-,郑州煤电,郑州煤电,"Zhengzhou Coal Industry & Electric Power Co.,Ltd.",19980107
600122,-,ST宏图,ST宏图,"Jiangsu Hongtu High Technology Co.,Ltd.",19980420
600123,-,兰花科创,兰花科创,"Shanxi Lanhua Sci-Tech Venture Co.,Ltd",19981217
600125,-,铁龙物流,铁龙物流,"China Railway Tielong Container Logistics Co.,Ltd",19980511
600126,-,杭钢股份,杭钢股份,"Hang Zhou Iron & Steel Co.,Ltd.",19980311
600127,-,金健米业,金健米业,"Jinjian Cereals Industry Co.,Ltd.",19980506
600128,-,弘业股份,弘业股份,Jiangsu Holly Corporation,19970901
600129,-,太极集团,太极集团,"Chongqing Taiji Industry (Group) Co.,Ltd.",19971118
600130,-,波导股份,波导股份,"Ningbo Bird Co.,Ltd.",20000706
600131,-,国网信通,国网信通,"State Grid Information&Telecommunication Co.,Ltd.",19980402
600132,-,重庆啤酒,重庆啤酒,CHONGQING BREWERY COMPANY LIMITED,19971030
600133,-,东湖高新,东湖高新,"Wuhan East Lake High Technology Group Co.,Ltd.",19980212
600135,-,乐凯胶片,乐凯胶片,Lucky Film Company Limited,19980122
600136,-,ST明诚,ST明诚,"Wuhan Ddmc Culture & Sports Co.,Ltd.",19980303
600137,-,浪莎股份,浪莎股份,Sichuan Langsha Holding Ltd.,19980416
600138,-,中青旅,中青旅,"China CYTS Tours Holding Co.,Ltd.",19971203
600139,-,*ST西源,*ST西源,"Sichuan Western Resources Holding Co., Ltd",19980225
600141,-,兴发集团,兴发集团,"Hubei Xingfa Chemicals Group Co.,Ltd",19990616
600143,-,金发科技,金发科技,"Kingfa Sci.&Tech. Co.,Ltd.",20040623
600148,-,长春一东,长春一东,"Changchun Yidong Clutch Co.,Ltd",19980520
600149,-,廊坊发展,廊坊发展,"Langfang Development Co.,Ltd.",19991014
600150,-,中国船舶,中国船舶,China CSSC Holdings Limited,19980520
600151,-,航天机电,航天机电,"Shanghai Aerospace Automobile Electromechanical Co.,Ltd.",19980605
600152,-,维科技术,维科技术,"Veken Technology.,Ltd.",19980609
600153,-,建发股份,建发股份,Xiamen C&D Inc.,19980616
600155,-,华创阳安,华创阳安,"Polaris Bay Group Co.,Ltd.",19980918
600156,-,华升股份,华升股份,"Hunan Huasheng Co.,Ltd",19980527
600157,-,永泰能源,永泰能源,"Wintime Energy Co.,Ltd.",19980513
600158,-,中体产业,中体产业,"China Sports Industry Group Co.,Ltd",19980327
600159,-,大龙地产,大龙地产,"Beijing Dalong Weiye Real Estate Development Co.,Ltd",19980526
600160,-,巨化股份,巨化股份,"Zhejiang Juhua Co.,Ltd",19980626
600161,-,天坛生物,天坛生物,Beijing Tiantan Biological Products Corporation Limited,19980616
600162,-,香江控股,香江控股,"Shenzhen Heungkong Holding Co.,Ltd",19980609
600163,-,中闽能源,中闽能源,"Zhongmin Energy Co., Ltd.",19980602
600165,-,宁科生物,宁科生物,"NINGXIA ZHONGKE BIOTECHNOLOGY CO., LTD",19980529
600166,-,福田汽车,福田汽车,"Beiqi Foton Motor Co.,Ltd.",19980602
600167,-,联美控股,联美控股,"Luenmei Quantum Co.,Ltd",19990128
600168,-,武汉控股,武汉控股,"Wuhan Sanzhen Industry Holding Co.,Ltd",19980427
600169,-,太原重工,太原重工,"Taiyuan Heavy Industry Co.,Ltd.",19980904
600170,-,上海建工,上海建工,"Shanghai Construction Group Co., Ltd.",19980623
600171,-,上海贝岭,上海贝岭,"Shanghai Belling Corp.,Ltd",19980924
600172,-,黄河旋风,黄河旋风,"Henan Huanghe Whirlwind Co., Ltd",19981126
600173,-,卧龙地产,卧龙地产,"Wolong Real Estate Group Co.,Ltd.",19990415
600176,-,中国巨石,中国巨石,"China Jushi Co.,Ltd",19990422
600177,-,雅戈尔,雅戈尔,"Youngor Group Co.,Ltd.",19981119
600178,-,东安动力,东安动力,"Harbin Dongan Auto Engine Co.,Ltd",19981014
600179,-,安通控股,安通控股,"Antong Holdings Co., Ltd.",19981104
600180,-,瑞茂通,瑞茂通,"CCS Supply Chain Management Co., Ltd.",19980703
600182,-,S*ST佳通,S*ST佳通,Giti Tire Corporation,19990507
600183,-,生益科技,生益科技,"Shengyi Technology Co.,Ltd.",19981028
600184,-,光电股份,光电股份,"North Electro-Optic Co.,Ltd.",20031106
600185,-,格力地产,格力地产,"Gree Real Estate Co.,Ltd",19990611
600186,-,莲花健康,莲花健康,Lotus Health Group Company,19980825
600187,-,国中水务,国中水务,"Heilongjiang Interchina Water Treatment Co.,Ltd",19981111
600188,-,兖矿能源,兖矿能源,YANKUANG ENERGY GROUP COMPANY LIMITED,19980701
600189,-,泉阳泉,泉阳泉,"Jilin Quanyangquan Co.,Ltd",19981007
600190,900952,锦州港,锦州港,"Jinzhou Port Co., Ltd.",19990609
600191,-,华资实业,华资实业,"Baotou Huazi Industry Co.,Ltd",19981210
600192,-,长城电工,长城电工,Lanzhou Greatwall Electrical Co.Ltd,19981224
600193,-,创兴资源,创兴资源,"Shanghai Prosolar Resources Development Co.,Ltd",19990527
600195,-,中牧股份,中牧股份,"China Animal Husbandry Industry Co.,Ltd.",19990107
600196,-,复星医药,复星医药,"Shanghai Fosun Pharmaceutical (Group) Co., Ltd.",19980807
600197,-,伊力特,伊力特,"Xinjiang Yilite Industry Co.,Ltd",19990916
600198,-,大唐电信,大唐电信,"Datang Telecom Technology Co., Ltd",19981021
600199,-,金种子酒,金种子酒,"Anhui Golden Seed Winery Co.,Ltd.",19980812
600200,-,江苏吴中,江苏吴中,"JiangSu WuZhong Pharmaceutical Development Co., Ltd.",19990401
600201,-,生物股份,生物股份,"Jinyu Bio-Technology Co.,Ltd.",19990115
600202,-,哈空调,哈空调,"Harbin Air Conditioning Co.,Ltd.",19990603
600203,-,福日电子,福日电子,"Fujian Furi Electronics Co., Ltd",19990514
600206,-,有研新材,有研新材,"Grinm Advanced Materials Co.,Ltd.",19990319
600207,-,安彩高科,安彩高科,"Henan Ancai Hi-Tech Co.,Ltd",19990714
600208,-,新湖中宝,新湖中宝,"Xinhu Zhongbao Co.,Ltd.",19990623
600210,-,紫江企业,紫江企业,"Shanghai Zijiang Enterprise Group Co.,Ltd",19990824
600211,-,西藏药业,西藏药业,Tibet Rhodiola Pharmaceutical Holding Co.,19990721
600212,-,绿能慧充,绿能慧充,"GRESGYING DIGITAL ENERGY TECHNOLOGY CO.,LTD",19990817
600213,-,亚星客车,亚星客车,"Yangzhou Yaxing Motor Coach Co., Ltd.",19990831
600215,-,派斯林,派斯林,"PASLIN DIGITAL TECHNOLOGY CO., LTD.",19990909
600216,-,浙江医药,浙江医药,"Zhejiang Medicine Co.,Ltd.",19991021
600217,-,中再资环,中再资环,"China Resources and Environment Co.,ltd.",19991216
600218,-,全柴动力,全柴动力,"Anhui Quanchai Engine Co.,Ltd",19981203
600219,-,南山铝业,南山铝业,"Shandong Nanshan Aluminium Co., Ltd.",19991223
600220,-,江苏阳光,江苏阳光,"Jiangsu Sunshine Co.,Ltd.",19990927
600221,900945,海航控股,海航控股,"Hainan Airlines Holding Co., Ltd.",19991125
600222,-,太龙药业,太龙药业,"Henan Taloph Pharmaceutical Stock Co.,Ltd",19991105
600223,-,鲁商发展,鲁商发展,"Lushang Health Industry Development Co.,Ltd.",20000113
600225,-,卓朗科技,卓朗科技,"IANJIN TROILA INFORMATION TECHNOLOGY CO.,LTD.",20000127
600226,-,ST瀚叶,ST瀚叶,"Zhejiang Hugeleaf Co.,Ltd.",19991116
600227,-,圣济堂,圣济堂,"Guizhou Salvage Pharmaceutical Co.,Ltd.",20000221
600228,-,返利科技,返利科技,"Fanli Digital Technology Co., Ltd",19990119
600229,-,城市传媒,城市传媒,"Qingdao Citymedia Co,. Ltd.",20000309
600230,-,沧州大化,沧州大化,"Cangzhou Dahua Co.,Ltd",20000406
600231,-,凌钢股份,凌钢股份,"Lingyuan Iron & Steel Co.,Ltd.",20000511
600232,-,金鹰股份,金鹰股份,"Zhejiang Golden Eagle Co.,Ltd.",20000602
600233,-,圆通速递,圆通速递,"YTO Express Group Co.,Ltd.",20000608
600234,-,科新发展,科新发展,"Kexin Development Co.,Ltd,Shanxi",20000615
600235,-,民丰特纸,民丰特纸,"Minfeng Special Paper Co.,Ltd.",20000615
600236,-,桂冠电力,桂冠电力,"Guangxi Guiguan Electric Power Co.,Ltd.",20000323
600237,-,铜峰电子,铜峰电子,Anhui Tongfeng Electronics Company Limited,20000609
600238,-,海南椰岛,海南椰岛,"Hainan Yedao (Group)Co.,Ltd",20000120
600239,-,ST云城,ST云城,"Yunnan Metropolitan Real Estate Development Co.,Ltd.",19991202
600241,-,ST时万,ST时万,"Liaoning Shidai Wanheng Co.,Ltd.",20001128
600242,-,*ST中昌,*ST中昌,Zhongchang Big Data Corporation Limited,20001207
600243,-,青海华鼎,青海华鼎,"Qinghaihuading Industrial Co.,Ltd.",20001120
600246,-,万通发展,万通发展,"Vantone Neo Development Group Co., Ltd",20000922
600248,-,陕西建工,陕西建工,Shaanxi Construction Engineering Group Corporation Limited,20000622
600249,-,两面针,两面针,"Liuzhou Liangmianzhen Co.,Ltd.",20040130
600250,-,南纺股份,南纺股份,"Nanjing Textiles Import & Export Corp.,Ltd.",20010306
600251,-,冠农股份,冠农股份,"XINJIANG GUANNONG CO.,LTD.",20030609
600252,-,中恒集团,中恒集团,"Guangxi Wuzhou Zhongheng Group Co.,Ltd",20001130
600255,-,鑫科材料,鑫科材料,"Anhui Xinke New Materials Co.,Ltd.",20001122
600256,-,广汇能源,广汇能源,"Guanghui Energy Co.,Ltd.",20000526
600257,-,大湖股份,大湖股份,"Dahu Aquaculture Co.,Ltd.",20000612
600258,-,首旅酒店,首旅酒店,"BTG Hotels (Group) Co., Ltd.",20000601
600259,-,广晟有色,广晟有色,"Rising Nonferrous Metals Share Co.,Ltd.",20000525
600261,-,阳光照明,阳光照明,"Zhejiang Yankon Group Co.,Ltd",20000720
600262,-,北方股份,北方股份,"Inner Mongolia North Hauler Joint Stock Co., Ltd",20000630
600265,-,ST景谷,ST景谷,"Yunnan Jinggu Forestry Co.,Ltd",20000825
600266,-,城建发展,城建发展,"Beijing Urban Construction Investment & Development Co.,Ltd.",19990203
600267,-,海正药业,海正药业,"Zhejiang Hisun Pharmaceutical Co.,Ltd.",20000725
600268,-,国电南自,国电南自,"Guodian Nanjing Automation Co.,Ltd",19991118
600269,-,赣粤高速,赣粤高速,"Jiangxi Ganyue Expressway Co., Ltd.",20000518
600271,-,航天信息,航天信息,Aisino Co.Ltd.,20030711
600272,900943,开开实业,开开实业,Shanghai Kai Kai Industrial Company Limited,20010228
600273,-,嘉化能源,嘉化能源,"Zhejiang Jiahua Energy Chemical Industry Co.,Ltd.",20030627
600276,-,恒瑞医药,恒瑞医药,"Jiangsu Hengrui Pharmaceuticals Co.,Ltd",20001018
600277,-,亿利洁能,亿利洁能,Elion Energy Company Limited,20000725
600278,-,东方创业,东方创业,"Orient International Enterprise, Ltd.",20000712
600279,-,重庆港,重庆港,"CHONGQING PORT CO.,LTD.",20000731
600280,-,中央商场,中央商场,"Nanjing Central Emporium (Group) Stocks Co.,Ltd.",20000926
600281,-,华阳新材,华阳新材,"Shanxi Huayang New Material Co.,Ltd.",20001109
600282,-,南钢股份,南钢股份,"Nanjing Iron & Steel Co.,Ltd.",20000919
600283,-,钱江水利,钱江水利,"Qian Jiang Water Resources Development Co.,Ltd",20001018
600284,-,浦东建设,浦东建设,"Shanghai Pudong Construction Co.,Ltd.",20040316
600285,-,羚锐制药,羚锐制药,"Henan Lingrui Pharmaceutical Co., Ltd",20001018
600287,-,江苏舜天,江苏舜天,"Jiangsu Sainty Corp.,Ltd",20000901
600288,-,大恒科技,大恒科技,"Daheng New Epoch Technology, Inc.",20001129
600289,-,ST信通,ST信通,Bright Oceans Inter-Telecom Corporation,20000720
600290,-,ST华仪,ST华仪,Huayi Electric Company Limited,20001106
600292,-,远达环保,远达环保,"Spic Yuanda Environmental—Protection Co. ,Ltd.",20001101
600293,-,三峡新材,三峡新材,"Hubei Sanxia New Building Materials Co.,Ltd",20000919
600295,900936,鄂尔多斯,鄂尔多斯,"INNER MONGOLIA ERDOS RESOURCES CO.,LTD.",20010426
600297,-,广汇汽车,广汇汽车,"China Grand Automotive Services Group Co., Ltd.",20001116
600298,-,安琪酵母,安琪酵母,"Angel Yeast Co.,Ltd",20000818
600299,-,安迪苏,安迪苏,Bluestar Adisseo Company,20000420
600300,-,维维股份,维维股份,"V V Food & Beverage Co.,Ltd.",20000630
600301,-,南化股份,南化股份,"Nanning Chemical Industry Co., Ltd",20000712
600302,-,标准股份,标准股份,"Xi'An Typical Industries Co.,Ltd",20001213
600303,-,ST曙光,ST曙光,"Liaoning Sg Automotive Group Co.,Ltd.",20001226
600305,-,恒顺醋业,恒顺醋业,"Jiangsu Hengshun Vinegar-Industry Co.,Ltd",20010206
600306,-,ST商城,ST商城,"Shenyang Commercial City Co.,Ltd.",20001226
600307,-,酒钢宏兴,酒钢宏兴,"Gansu Jiu Steel Group Hongxing Iron & Steel Co.,Ltd.",20001220
600308,-,华泰股份,华泰股份,"Shandong Huatai Paper Industry Shareholding Co.,Ltd",20000928
600309,-,万华化学,万华化学,"Wanhua Chemical Group Co.,Ltd.",20010105
600310,-,桂东电力,桂东电力,"Guangxi Guidong Electric Power Co.,Ltd",20010228
600311,-,*ST荣华,*ST荣华,"Gansu Ronghua Industry Group Co.,Ltd.",20010626
600312,-,平高电气,平高电气,"Henan Pinggao Electric Co.,Ltd",20010221
600313,-,农发种业,农发种业,"Zhongnongfa Seed Industry Group Co., Ltd.",20010119
600315,-,上海家化,上海家化,"Shanghai Jahwa United Co.,Ltd.",20010315
600316,-,洪都航空,洪都航空,"Jiangxi Hongdu Aviation Industry Co.,Ltd.",20001215
600318,-,新力金融,新力金融,"Anhui Xinli Finance Co.,Ltd.",20001208
600319,-,亚星化学,亚星化学,"Weifang Yaxing Chemical Co.,Ltd.",20010326
600320,900947,振华重工,振华重工,"Shanghai Zhenhua Heavy Industries Co.,Ltd.",20001221
600321,-,正源股份,正源股份,"Rightway Holdings Co., Ltd.",20010524
600322,-,天房发展,天房发展,"Tianjin Realty Development(Group) Co.,Ltd.",20010910
600323,-,瀚蓝环境,瀚蓝环境,"Grandblue Environment Co.,Ltd.",20001225
600325,-,华发股份,华发股份,"Zhuhai Huafa Properties Co.,Ltd",20040225
600326,-,西藏天路,西藏天路,"Tibet Tianlu Co., Ltd.",20010116
600327,-,大东方,大东方,"Wuxi Commercial Mansion Grand Orient Co.,Ltd",20020625
600328,-,中盐化工,中盐化工,"CNSIG Inner Mongolia Chemical Industry Co., Ltd.",20001222
600329,-,达仁堂,达仁堂,TIANJIN PHARMACEUTICAL DA REN TANG GROUP CORPORATION LIMITED,20010606
600330,-,天通股份,天通股份,"TDG Holding Co.,Ltd",20010118
600331,-,宏达股份,宏达股份,"Sichuan Hongda Co.,Ltd",20011220
600332,-,白云山,白云山,Guangzhou Baiyunshan Pharmaceutical Holdings Company Limited,20010206
600333,-,长春燃气,长春燃气,"Changchun Gas Co.,Ltd",20001211
600335,-,国机汽车,国机汽车,"Sinomach Automobile Co., Ltd.",20010305
600336,-,澳柯玛,澳柯玛,"AUCMA Co., Ltd.",20001229
600337,-,美克家居,美克家居,"Markor International Home Furnishings Co., Ltd.",20001127
600338,-,西藏珠峰,西藏珠峰,"Tibet Summit Resources Co., Ltd.",20001227
600339,-,中油工程,中油工程,"China Petroleum Engineering Co., Ltd.",20001225
600340,-,华夏幸福,华夏幸福,"China Fortune Land Development Co.,Ltd.",20031230
600343,-,航天动力,航天动力,"Shaanxi Aerospace Power Hi-Tech Co.,Ltd",20030408
600345,-,长江通信,长江通信,"Wuhan Yangtze Communication Industry Group Co.,Ltd",20001222
600346,-,恒力石化,恒力石化,"Hengli Petrochemical Co.,Ltd.",20010820
600348,-,华阳股份,华阳股份,"Shan Xi Hua Yang Group New Energy Co.,Ltd.",20030821
600350,-,山东高速,山东高速,Shandong Hi-Speed Company Limited,20020318
600351,-,亚宝药业,亚宝药业,"Yabao Pharmaceutical Group Co.,Ltd",20020926
600352,-,浙江龙盛,浙江龙盛,"Zhejiang Longsheng Group Co.,Ltd",20030801
600353,-,旭光电子,旭光电子,"Chengdu Xuguang Electronics Co.,Ltd.",20021120
600354,-,敦煌种业,敦煌种业,"Gansu Dunhuang Seed Group Co.,Ltd.",20040115
600355,-,精伦电子,精伦电子,"Routon Electronic Co.,Ltd.",20020613
600356,-,恒丰纸业,恒丰纸业,"Mudanjiang Hengfeng Paper Co.,Ltd",20010419
600358,-,国旅联合,国旅联合,"CHINA TOURISM AND CULTURE INVESTMENT GROUP CO.,LTD",20000922
600359,-,新农开发,新农开发,"Xinjiang Talimu Agriculture Development Co.,Ltd.",19990429
600360,-,华微电子,华微电子,"Jilin Sino-Microelectronics Co.,Ltd.",20010316
600361,-,创新新材,创新新材,"INNOVATION NEW MATERIAL TECHNOLOGY CO., LTD.",20011129
600362,-,江西铜业,江西铜业,Jiangxi Copper Company Limited,20020111
600363,-,联创光电,联创光电,"Jiangxi Lianchuang Opto-Electronic Science&Technology Co.,Ltd",20010329
600365,-,ST通葡,ST通葡,"Tonghua Grape Wine Co.,Ltd",20010115
600366,-,宁波韵升,宁波韵升,"Ningbo Yunsheng Co.,Ltd.",20001030
600367,-,红星发展,红星发展,"Guizhou Redstar Developing Co.,Ltd.",20010320
600368,-,五洲交通,五洲交通,"Guangxi Wuzhou Communications Co.,Ltd.",20001221
600369,-,西南证券,西南证券,"Southwest Securities Co.,Ltd.",20010109
600370,-,三房巷,三房巷,"Jiangsu Sanfame Polyester Material Co.,Ltd.",20030306
600371,-,万向德农,万向德农,"Wanxiang Doneed Co.,Ltd",20020916
600372,-,中航电子,中航电子,"China Avionics Systems Co.,Ltd.",20010706
600373,-,中文传媒,中文传媒,"Chinese Universe Publishing and Media Group Co.,Ltd.",20020304
600375,-,汉马科技,汉马科技,"Hanma Technology Group Co.,Ltd.",20030401
600376,-,首开股份,首开股份,"Beijing Capital Development Co.,Ltd.",20010312
600377,-,宁沪高速,宁沪高速,Jiangsu Expressway Company Limited,20010116
600378,-,昊华科技,昊华科技,"Haohua Chemical Science & Technology Corp., Ltd.",20010111
600379,-,宝光股份,宝光股份,"SHAANXI BAOGUANG VACUUM ELECTRIC DEVICE CO., LTD.",20020116
600380,-,健康元,健康元,"Joincare Pharmaceutical Group Industry Co., Ltd.",20010608
600381,-,青海春天,青海春天,"Qinghai Spring Medicinal Resources Technology Co., Ltd",20010508
600382,-,ST广珠,ST广珠,"Guangdong Mingzhu Group Co.,Ltd",20010118
600383,-,金地集团,金地集团,Gemdale Corporation,20010412
600386,-,北巴传媒,北巴传媒,"Beijing Bashi Media Co.,Ltd.",20010216
600387,-,海越能源,海越能源,"HY Energy Group Co.,Ltd",20040218
600388,-,ST龙净,ST龙净,"Fujian Longking Co.,Ltd",20001229
600389,-,江山股份,江山股份,"Nantong Jiangshan Agrochemical&Chemicals Co.,Ltd.",20010110
600390,-,五矿资本,五矿资本,Minmetals Capital Company Limited,20010115
600391,-,航发科技,航发科技,"Aecc Aero Science and Technology Co.,Ltd",20011212
600392,-,盛和资源,盛和资源,"Shenghe Resources Holding Co.,Ltd",20030529
600393,-,粤泰股份,粤泰股份,"Guangzhou Yuetai Group Co.,Ltd.",20010319
600395,-,盘江股份,盘江股份,"Guizhou Panjiang Refined Coal Co.,Ltd.",20010531
600396,-,金山股份,金山股份,"Shenyang Jinshan Energy Co.,Ltd",20010328
600397,-,安源煤业,安源煤业,"Anyuan Coal Industry Group Co., Ltd.",20020702
600398,-,海澜之家,海澜之家,"Hla Group Corp., Ltd.",20001228
600399,-,抚顺特钢,抚顺特钢,"Fushun Special Steel Co.,LTD.",20001229
